{
  "version": "1.0",
  "defaults": {
    "type": "auto",
    "updateInterval": 21600,
    "enabled": true
  },
  "sources": [
    {
      "id": "jjgy",
      "url": "https://zh.jikun.fun/share/col/%E6%B1%9F%E6%B1%9F%E5%85%AC%E7%9B%8A?token=1yGRuU-x6r_zEz28cE_pE"
    },
    {
      "id": "nodesfree",
      "url": "https://nodesfree.github.io/clashnode/clash.yaml"
    },
    {
      "id": "free",
      "url": "https://proxy.v2gh.com/https://raw.githubusercontent.com/Pawdroid/Free-servers/main/sub"
    },
    {
      "id": "amaoa",
      "url": "https://blue2sea.com/clash/54e970b014f53d042de7bbc1d011cc0c"
    },
    {
      "id": "auto",
      "url": "https://raw.githubusercontent.com/chengaopan/AutoMergePublicNodes/master/list.txt"
    },
    {
      "id": "airport",
      "url": "https://raw.githubusercontent.com/dongchengjie/airport/refs/heads/main/subs/merged/tested_within.yaml"
    },
    {
      "id": "freennode",
      "url": "https://raw.githubusercontent.com/free-nodes/v2rayfree/main/v20260119.txt"
    },
    {
      "id": "alalbb",
      "url": "https://raw.githubusercontent.com/free-nodes/clashfree/main/clash20260119.yml"
    },
    {
      "id": "zu",
      "url": "https://raw.githubusercontent.com/chengaopan/AutoMergePublicNodes/master/list.txt"
    },
    {
      "id": "ss",
      "url": "https://raw.githubusercontent.com/xyfqzy/free-nodes/main/nodes/v2ray.txt"
    },
    {
      "id": "pianyi",
      "url": "https://free.cndyw.ggff.net/sub"
    },
    {
      "id": "edgesub",
      "url": "https://raw.githubusercontent.com/littlepig-s/edgesub/main/demo.txt"
    },
    {
      "id": "miaopu",
      "url": "https://raw.githubusercontent.com/kismetpro/NodeSuber/main/out/All_Configs_Sub.txt"
    },
    {
      "id": "sub2",
      "url": "https://raw.githubusercontent.com/WLget/V2Ray_configs_64/master/ConfigSub_list.txt"
    },
    {
      "id": "xship",
      "url": "https://mu40zG.mcsslk.xyz/742a40491d5bddcaf7051eb41d19cb2f"
    }
  ],
  "conversionRules": {
    "mihomo": {
      "enabledByDefault": true,
      "template": "config/templates/mihomo.yaml"
    },
    "surge": {
      "enabledByDefault": true,
      "template": "config/templates/surge.conf"
    },
    "v2ray": {
      "enabledByDefault": true
    }
  }
}